{
  "version": 1,
  "job_id": "j000000000000000000000000",
  "attempt_id": "a000000000000000000000000",
  "lease": "000000000000000000000000000000000000000000000000",
  "context_fingerprint": "0000000000000000000000000000000000000000000000000000000000000000",
  "status": "deferred",
  "edits": [],
  "reason": "replace_fixture_identity_before_use",
  "risks": ["This example is not a real lease, proposal or verification result."],
  "test_plan": "Describe a scoped behavioral test plan; no tests have been executed."
}
